{
  "$schema": "https://json-schema.org/draft/2020-12/schema",
  "$id": "https://aragora.ai/specs/open-decision-receipt/v0.2/schema.json",
  "title": "Open Decision Receipt (ODR) content profiles v0.1 and v0.2",
  "description": "Vendor-neutral decision-semantics receipt profile. Canonicalization basis: RFC 8785 (JCS). Designed to ride SCITT/COSE envelopes via detached signatures. See docs/specs/OPEN_DECISION_RECEIPT.md.",
  "type": "object",
  "allOf": [
    {
      "if": {"properties": {"odr_version": {"const": "0.1"}}},
      "then": {
        "properties": {
          "profile": {"const": "https://aragora.ai/specs/open-decision-receipt/v0.1"}
        }
      }
    },
    {
      "if": {"properties": {"odr_version": {"const": "0.2"}}},
      "then": {
        "properties": {
          "profile": {"const": "https://aragora.ai/specs/open-decision-receipt/v0.2"}
        }
      }
    },
    {
      "if": {"required": ["odr_version"], "properties": {"odr_version": {"const": "0.1"}}},
      "then": {
        "properties": {
          "adjudication": false,
          "subject": {
            "properties": {
              "repository": false,
              "pr_number": false,
              "head_sha": false,
              "base_sha": false
            }
          },
          "quorum": {
            "properties": {
              "verdicts": false,
              "rule": false,
              "dissent": {
                "properties": {
                  "findings": false,
                  "severity_max": false,
                  "blocking": false
                }
              }
            }
          },
          "reasoning": {"properties": {"observations": false}}
        }
      }
    }
  ],
  "required": [
    "odr_version",
    "profile",
    "receipt_id",
    "issued_at",
    "subject",
    "claim",
    "reasoning",
    "quorum",
    "confidence",
    "cruxes",
    "attestation",
    "routing",
    "signatures"
  ],
  "properties": {
    "odr_version": {
      "type": "string",
      "enum": ["0.1", "0.2"]
    },
    "profile": {
      "type": "string",
      "enum": [
        "https://aragora.ai/specs/open-decision-receipt/v0.1",
        "https://aragora.ai/specs/open-decision-receipt/v0.2"
      ]
    },
    "receipt_id": {
      "type": "string",
      "minLength": 1
    },
    "issued_at": {
      "type": ["string", "null"],
      "description": "ISO-8601 timestamp from the source receipt; null when the source recorded none (never fabricated)."
    },
    "subject": {
      "type": "object",
      "required": ["identifier", "digest"],
      "properties": {
        "identifier": {
          "type": "string",
          "description": "Stable identifier of the decided subject: artifact SHA, action id, debate/gauntlet id."
        },
        "digest": {
          "oneOf": [
            {
              "type": "object",
              "required": ["status", "alg", "value"],
              "properties": {
                "status": { "const": "present" },
                "alg": { "type": "string" },
                "value": { "type": "string", "minLength": 1 }
              },
              "additionalProperties": false
            },
            { "$ref": "#/$defs/absent" }
          ]
        },
        "summary": { "type": "string" },
        "repository": { "type": "string" },
        "pr_number": { "type": "integer" },
        "head_sha": { "type": "string" },
        "base_sha": { "type": "string" }
      },
      "additionalProperties": false
    },
    "claim": {
      "type": "object",
      "required": ["verdict", "statement"],
      "properties": {
        "verdict": {
          "type": "string",
          "minLength": 1,
          "description": "Outcome asserted about the subject (e.g. PASS / CONDITIONAL / FAIL)."
        },
        "statement": {
          "oneOf": [
            { "type": "string", "minLength": 1 },
            { "$ref": "#/$defs/absent" }
          ]
        }
      },
      "additionalProperties": false
    },
    "reasoning": {
      "oneOf": [
        {
          "type": "object",
          "required": ["status", "summary"],
          "properties": {
            "status": { "const": "present" },
            "summary": { "type": "string", "minLength": 1 },
            "observations": {
              "type": "array",
              "items": {
                "type": "object",
                "required": ["kind", "family", "detail"],
                "properties": {
                  "kind": { "enum": ["timeout", "failure", "rerun"] },
                  "family": { "type": "string" },
                  "detail": { "type": "string" }
                },
                "additionalProperties": false
              }
            }
          },
          "additionalProperties": false
        },
        { "$ref": "#/$defs/absent" }
      ]
    },
    "quorum": {
      "oneOf": [
        {
          "type": "object",
          "required": [
            "status",
            "method",
            "reached",
            "supporting_agents",
            "participants",
            "independence",
            "dissent"
          ],
          "properties": {
            "status": { "const": "present" },
            "method": { "type": "string" },
            "reached": { "type": "boolean" },
            "verdicts": {
              "type": "array",
              "items": {
                "type": "object",
                "required": ["issuer", "verdict", "model_family", "model_id"],
                "properties": {
                  "issuer": { "type": "string" },
                  "role": { "type": "string" },
                  "verdict": { "type": "string" },
                  "model_family": { "type": "string" },
                  "model_id": { "type": "string" },
                  "head_sha": { "type": "string" },
                  "posted_at": { "type": "string" },
                  "grounded": { "type": "boolean" },
                  "counted": { "type": "boolean" },
                  "severity_max": { "$ref": "#/$defs/severity" },
                  "blocking": { "type": "boolean" }
                },
                "additionalProperties": false
              }
            },
            "rule": {
              "type": "object",
              "required": [
                "required_signals",
                "requires_western_frontier",
                "western_only_counted",
                "counted_families"
              ],
              "properties": {
                "required_signals": { "type": "integer" },
                "requires_western_frontier": { "type": "boolean" },
                "western_only_counted": { "type": "boolean" },
                "counted_families": { "type": "array", "items": { "type": "string" } }
              },
              "additionalProperties": false
            },
            "supporting_agents": {
              "type": "array",
              "items": { "type": "string" }
            },
            "participants": {
              "type": "array",
              "items": {
                "type": "object",
                "required": ["agent", "model_family", "model_id"],
                "properties": {
                  "agent": { "type": "string", "minLength": 1 },
                  "model_family": {
                    "type": "string",
                    "description": "Provider/model family, or the literal string 'undisclosed' when the source recorded none."
                  },
                  "model_id": { "type": "string" }
                },
                "additionalProperties": false
              }
            },
            "independence": {
              "type": "object",
              "required": ["disclosed", "distinct_model_families", "model_families"],
              "properties": {
                "disclosed": { "type": "boolean" },
                "distinct_model_families": { "type": "integer", "minimum": 0 },
                "model_families": {
                  "type": "array",
                  "items": { "type": "string" }
                },
                "note": { "type": "string" }
              },
              "additionalProperties": false
            },
            "dissent": {
              "type": "object",
              "required": ["present", "dissenting_agents", "views"],
              "properties": {
                "present": { "type": "boolean" },
                "findings": {
                  "type": "array",
                  "items": {
                    "type": "object",
                    "required": ["issuer", "severity", "blocking", "text"],
                    "properties": {
                      "issuer": { "type": "string" },
                      "severity": { "$ref": "#/$defs/severity" },
                      "blocking": { "type": "boolean" },
                      "location": { "type": "string" },
                      "text": { "type": "string" }
                    },
                    "additionalProperties": false
                  }
                },
                "severity_max": { "$ref": "#/$defs/severity" },
                "blocking": { "type": "boolean" },
                "dissenting_agents": {
                  "type": "array",
                  "items": { "type": "string" }
                },
                "views": {
                  "type": "array",
                  "items": { "type": "string" }
                }
              },
              "additionalProperties": false
            }
          },
          "additionalProperties": false
        },
        { "$ref": "#/$defs/absent" }
      ]
    },
    "confidence": {
      "oneOf": [
        {
          "type": "object",
          "required": ["status", "value", "scale", "calibration"],
          "properties": {
            "status": { "const": "present" },
            "value": { "type": "number", "minimum": 0, "maximum": 1 },
            "scale": { "const": "unit_interval" },
            "calibration": {
              "oneOf": [
                {
                  "type": "object",
                  "required": ["status", "provenance_ref"],
                  "properties": {
                    "status": { "const": "present" },
                    "provenance_ref": {
                      "type": "object",
                      "required": ["type"],
                      "properties": {
                        "type": { "type": "string", "minLength": 1 },
                        "receipt_id": { "type": "string" },
                        "uri": { "type": "string" }
                      },
                      "additionalProperties": true
                    }
                  },
                  "additionalProperties": false
                },
                { "$ref": "#/$defs/absent" }
              ]
            }
          },
          "additionalProperties": false
        },
        { "$ref": "#/$defs/absent" }
      ]
    },
    "cruxes": {
      "oneOf": [
        {
          "type": "object",
          "required": ["status", "items"],
          "properties": {
            "status": { "const": "present" },
            "items": {
              "type": "array",
              "minItems": 1,
              "items": { "type": "object" }
            }
          },
          "additionalProperties": false
        },
        { "$ref": "#/$defs/absent" }
      ]
    },
    "attestation": {
      "type": "object",
      "required": ["disposition"],
      "properties": {
        "disposition": {
          "type": "string",
          "enum": ["human_attested", "autonomous"]
        },
        "attestor": {
          "type": "object",
          "properties": {
            "id": { "type": "string" },
            "name": { "type": "string" },
            "role": { "type": "string" }
          },
          "additionalProperties": true
        },
        "attested_at": { "type": "string" },
        "method": { "type": "string" },
        "execution_identity": {
          "type": "object",
          "properties": {
            "id": { "type": "string" },
            "name": { "type": "string" },
            "role": { "type": "string" }
          },
          "additionalProperties": true,
          "description": "Identity that executed the decision, recorded distinct from the oversight attestor (ODR-6 / #8230)."
        },
        "observed": {
          "type": "object",
          "properties": {
            "head_sha": { "type": "string" },
            "evidence_digest": { "type": "string" }
          },
          "additionalProperties": true,
          "description": "What the attestor saw when accepting the risk: head SHA and evidence digest."
        },
        "mechanism": {
          "type": "object",
          "required": ["type"],
          "properties": {
            "type": { "type": "string" },
            "context": { "type": "string" },
            "ref": { "type": "string" },
            "policy_version": { "type": "integer" },
            "tier": { "type": ["integer", "null"] },
            "tiered_gate": { "type": "boolean" },
            "severity_gated": { "type": "boolean" },
            "action": { "type": "string" },
            "action_reason": { "type": "string" },
            "record_ref": { "type": "string" }
          },
          "additionalProperties": true,
          "description": "How the attestation was recorded, e.g. settlement_status (aragora/human-settlement) or preapproval_comment, with a resolvable ref."
        }
      },
      "if": {
        "properties": { "disposition": { "const": "human_attested" } }
      },
      "then": {
        "required": ["disposition", "attestor"]
      },
      "additionalProperties": false
    },
    "adjudication": {
      "type": "object",
      "required": ["kind", "verdict", "reason"],
      "properties": {
        "kind": { "const": "review_adjudication.v1" },
        "verdict": { "enum": ["settle", "block", "escalate", "not_applicable"] },
        "reason": { "type": "string" },
        "groundedness_bar": { "type": "number" },
        "advisory_severity_policy": { "enum": ["cap_at_advisory", "promote_grounded_to_block"] },
        "policy": { "type": "object" },
        "assessments": { "type": "array", "items": { "type": "object" } },
        "blocking_findings": { "type": "array", "items": { "type": "string" } },
        "escalated_findings": { "type": "array", "items": { "type": "string" } },
        "settled_findings": { "type": "array", "items": { "type": "string" } }
      },
      "additionalProperties": false
    },
    "routing": {
      "type": "object",
      "required": ["status"],
      "properties": {
        "status": { "const": "reserved" }
      },
      "additionalProperties": false,
      "description": "Reserved block for downstream channel routing metadata. Emitters MUST set status=reserved in v0.1."
    },
    "signatures": {
      "type": "array",
      "description": "Reserved for detached signatures (Ed25519, issue #8225). Empty in v0.1; signatures cover the SHA-256 of the JCS bytes of the payload with this array removed.",
      "items": {
        "type": "object",
        "required": ["alg", "key_id", "signature"],
        "properties": {
          "alg": { "type": "string", "enum": ["Ed25519"] },
          "key_id": { "type": "string", "minLength": 1 },
          "signature": { "type": "string", "minLength": 1 },
          "signed_at": { "type": "string" }
        },
        "additionalProperties": false
      }
    },
    "source": {
      "type": "object",
      "required": ["system", "schema", "receipt_id"],
      "properties": {
        "system": { "type": "string" },
        "schema": { "type": "string" },
        "schema_version": { "type": "string" },
        "receipt_id": { "type": "string" },
        "artifact_hash": { "type": "string" }
      },
      "additionalProperties": false
    }
  },
  "additionalProperties": false,
  "$defs": {
    "severity": { "enum": ["P0", "P1", "P2", "P3"] },
    "absent": {
      "type": "object",
      "required": ["status", "reason"],
      "properties": {
        "status": { "const": "absent" },
        "reason": { "type": "string", "minLength": 1 }
      },
      "additionalProperties": false,
      "description": "Explicit absent marker: the emitter's source data could not supply this field. Emitters MUST NOT fabricate values to avoid this marker."
    }
  }
}
