{
  "odr_version": "0.1",
  "profile": "https://aragora.ai/specs/open-decision-receipt/v0.1",
  "receipt_id": "pr-9030-6fe6ad588f4c",
  "issued_at": null,
  "subject": {
    "identifier": "merge-quorum/synaptent/aragora#9030",
    "digest": {
      "status": "present",
      "alg": "sha-256",
      "value": "0a8520b52b1d539d8cf6131cb2a7fe31994fc8057bf95446ba4abbfab8217dec"
    },
    "summary": "Merge synaptent/aragora#9030 @ 6fe6ad588f4c"
  },
  "claim": {
    "verdict": "CHANGES_REQUESTED",
    "statement": "Merge synaptent/aragora#9030 @ 6fe6ad588f4c"
  },
  "reasoning": {
    "status": "present",
    "summary": "No reviewers produced a passing verdict"
  },
  "quorum": {
    "status": "present",
    "method": "merge-quorum",
    "reached": false,
    "supporting_agents": [],
    "participants": [
      {
        "agent": "grok",
        "model_family": "xai",
        "model_id": "undisclosed"
      },
      {
        "agent": "mistral",
        "model_family": "mistral",
        "model_id": "undisclosed"
      }
    ],
    "independence": {
      "disclosed": true,
      "distinct_model_families": 2,
      "model_families": [
        "mistral",
        "xai"
      ]
    },
    "dissent": {
      "present": true,
      "dissenting_agents": [
        "grok",
        "mistral"
      ],
      "views": [
        "grok: Verdict: CHANGES-REQUESTED\n- [P2] domain_matcher.py:477: _detect_with_llm now returns None (new empty-content path + changed invalid-text path) but is annotated `-> list[tuple[str, float]]`, risking type errors or unhandled None at callers\n- [P2] tests/routing/test_domain_matcher_root.py:30: removal of anthropic.types monkey-patch may regress other tests that relied on the real TextBlock shape rather than SimpleNamespace",
        "mistral: Verdict: CHANGES-REQUESTED\n\n- [P1] `aragora/routing/domain_matcher.py` line 482: Returning `None` on empty content breaks the caller’s expectation of a list; the existing fallback logic in `detect()` will crash when it tries to iterate over `None`. Revert to `return []`.\n- [P2] `aragora/routing/domain_matcher.py` line 488: Same issue—returning `None` instead of `[]` risks a regression in the caller.\n- [P3] `tests/routing/test_domain_matcher_root.py` lines 15–21: Removed the `anthropic` module mock setup, but the test suite still relies on it elsewhere; this may cause unrelated tests to fail if they run after this one. Either restore the mock or ensure all tests are isolated."
      ]
    }
  },
  "confidence": {
    "status": "present",
    "value": 0.0,
    "scale": "unit_interval",
    "calibration": {
      "status": "present",
      "provenance_ref": {
        "type": "aragora.settlement_metadata",
        "receipt_id": "pr-9030-6fe6ad588f4c"
      }
    }
  },
  "cruxes": {
    "status": "absent",
    "reason": "no crux set recorded for this decision (DecisionReceipt does not carry one; supply crux_set= from a CruxReceipt)"
  },
  "attestation": {
    "disposition": "autonomous"
  },
  "routing": {
    "status": "reserved"
  },
  "signatures": [],
  "source": {
    "system": "aragora",
    "schema": "aragora.gauntlet.DecisionReceipt",
    "schema_version": "1.1",
    "receipt_id": "pr-9030-6fe6ad588f4c",
    "artifact_hash": "428ad021951600e2d8cfbada9b2e3a6bfd51855364042a7053d9ddb1762604b4"
  }
}
